{
  "$schema": "https://json-schema.org/draft/2020-12/schema",
  "$id": "vg.ir/v1",
  "type": "object",
  "required": ["schema", "version", "root_schema", "instructions", "effects"],
  "properties": {
    "schema": {"const": "vg.ir/v1"},
    "version": {"type": "integer", "minimum": 1},
    "root_schema": {"type": "string", "minLength": 1},
    "instructions": {"type": "array", "minItems": 1},
    "effects": {"type": "array"}
  }
}
