{
  "schema": "vg.ir/v1",
  "version": 1,
  "root_schema": "vg.fixture/store-only",
  "instructions": [
    {"op": "store", "allocation": 1, "offset": 0, "size": 4, "value": 9, "generation": 1, "representation_epoch": 0, "source": "store_only:0"}
  ],
  "effects": [
    {"allocation": 1, "offset": 0, "size": 4, "access": "write", "representation_epoch": 0}
  ]
}
